{
  "$schema": "https://json-schema.org/draft/2020-12/schema",
  "$id": "https://vitryne.app/schema/1/garment.schema.json",
  "title": "Vitryne format v1: garments/<id>.json",
  "description": "One garment: its pattern pieces (2D, mm), how many times each is cut, where each cut starts around the avatar, and which runs of outline are sewn together.",
  "type": "object",
  "properties": {
    "id": { "$ref": "common.schema.json#/$defs/id" },
    "name": { "$ref": "common.schema.json#/$defs/name" },
    "fabric": {
      "description": "The fabric of every cut that doesn't name its own.",
      "$ref": "common.schema.json#/$defs/id"
    },
    "appearance": {
      "description": "The appearance (colour) of every cut that doesn't name its own. Absent: the app's own.",
      "$ref": "common.schema.json#/$defs/id"
    },
    "pieces": {
      "description": "Empty in a garment started from scratch, before its first piece is drawn.",
      "type": "array",
      "items": { "$ref": "#/$defs/piece" }
    },
    "stack": {
      "description": "Every cut of the garment once, closest to the body first. Where cuts overlap on the body, the one higher in the list starts further out. A cut that goes on another (follow) comes after it.",
      "type": "array",
      "items": { "$ref": "common.schema.json#/$defs/id" },
      "uniqueItems": true
    },
    "seams": {
      "type": "array",
      "items": { "$ref": "#/$defs/seam" }
    },
    "simulation": {
      "description": "Overrides of the project's simulation settings for this garment.",
      "type": "object",
      "properties": {
        "targetVertices": { "type": "integer", "minimum": 100 },
        "engine": {
          "description": "Sparse engine tuning, merged over the project's (same rules: engine keys and units).",
          "type": "object"
        },
        "collisionBounds": {
          "description": "The box (mm, avatar space) the cloth can reach, for the body's collision field. Optional: the engine derives one when absent.",
          "type": "object",
          "properties": {
            "min": { "$ref": "common.schema.json#/$defs/vec3" },
            "max": { "$ref": "common.schema.json#/$defs/vec3" }
          },
          "required": ["min", "max"],
          "unevaluatedProperties": false
        },
        "extensions": { "$ref": "common.schema.json#/$defs/extensions" },
        "extras": { "$ref": "common.schema.json#/$defs/extras" }
      },
      "unevaluatedProperties": false
    },
    "sources": {
      "description": "Imported originals this garment was made from (e.g. a DXF-AAMA file), kept as parts with role source. For reference and re-import only: nothing is read from them.",
      "type": "array",
      "items": { "$ref": "#/$defs/source" }
    },
    "attribution": { "$ref": "common.schema.json#/$defs/attribution" },
    "libraryRef": { "$ref": "common.schema.json#/$defs/libraryRef" },
    "extensions": { "$ref": "common.schema.json#/$defs/extensions" },
    "extras": { "$ref": "common.schema.json#/$defs/extras" }
  },
  "required": ["id", "name", "fabric", "pieces", "stack", "seams"],
  "unevaluatedProperties": false,
  "$defs": {
    "piece": {
      "description": "A pattern piece as drafted, in its own 2D frame (mm, +y towards the top of the garment), seen from the right side of the fabric. Cut-on-fold pieces are stored unfolded, with the fold kept in folds.",
      "type": "object",
      "properties": {
        "id": { "$ref": "common.schema.json#/$defs/id" },
        "name": { "$ref": "common.schema.json#/$defs/name" },
        "outline": {
          "description": "The sewing line, a closed loop of nodes in counter-clockwise order. Each node's edge runs to the next node (the last one's back to the first).",
          "type": "array",
          "items": { "$ref": "#/$defs/outlineNode" },
          "minItems": 3
        },
        "lines": {
          "description": "Internal lines (pocket placement, darts, stitching lines): open paths inside the piece. They are meshed as creases and can be sewn.",
          "type": "array",
          "items": { "$ref": "#/$defs/line" }
        },
        "folds": {
          "description": "Fold lines of a cut-on-fold piece: the straight line between two outline nodes the piece was mirrored about.",
          "type": "array",
          "items": { "$ref": "#/$defs/fold" }
        },
        "grain": {
          "description": "The grain line, as drawn: its direction (to - from) is the fabric's warp. Absent: +y.",
          "type": "object",
          "properties": {
            "from": { "$ref": "common.schema.json#/$defs/vec2" },
            "to": { "$ref": "common.schema.json#/$defs/vec2" }
          },
          "required": ["from", "to"],
          "unevaluatedProperties": false
        },
        "cuts": {
          "description": "How many times the piece is cut, and how each copy is used. Seams and placement refer to cuts.",
          "type": "array",
          "items": { "$ref": "#/$defs/cut" },
          "minItems": 1
        },
        "source": {
          "description": "The piece in an imported source this was made from.",
          "type": "object",
          "properties": {
            "source": { "$ref": "common.schema.json#/$defs/id" },
            "piece": { "description": "The piece's name in the source.", "type": "string" }
          },
          "required": ["source", "piece"],
          "unevaluatedProperties": false
        },
        "extensions": { "$ref": "common.schema.json#/$defs/extensions" },
        "extras": { "$ref": "common.schema.json#/$defs/extras" }
      },
      "required": ["id", "name", "outline", "cuts"],
      "unevaluatedProperties": false
    },
    "node": {
      "description": "A point of a piece that other things refer to. corner: the outline turns here. notch: an alignment notch. point: anything else worth naming (fold ends, where an internal line meets the outline, a point added for a seam).",
      "type": "object",
      "properties": {
        "id": { "$ref": "common.schema.json#/$defs/id" },
        "type": { "enum": ["corner", "notch", "point"] },
        "name": { "$ref": "common.schema.json#/$defs/name" },
        "position": { "$ref": "common.schema.json#/$defs/vec2" },
        "edge": { "$ref": "#/$defs/edge" },
        "extensions": { "$ref": "common.schema.json#/$defs/extensions" },
        "extras": { "$ref": "common.schema.json#/$defs/extras" }
      },
      "required": ["id", "type", "position"]
    },
    "outlineNode": {
      "$ref": "#/$defs/node",
      "required": ["edge"],
      "unevaluatedProperties": false
    },
    "edge": {
      "description": "The path from this node to the next one: a polyline (core) or a cubic Bézier (extension VTRY_curves). Other curve types (arcs) may be added by later versions or extensions.",
      "oneOf": [
        { "$ref": "#/$defs/polylineEdge" },
        { "$ref": "#/$defs/cubicEdge" }
      ]
    },
    "polylineEdge": {
      "description": "The points strictly between the two nodes, in order (empty for a straight edge).",
      "type": "object",
      "properties": {
        "type": { "const": "polyline" },
        "points": {
          "type": "array",
          "items": { "$ref": "common.schema.json#/$defs/vec2" }
        },
        "extensions": { "$ref": "common.schema.json#/$defs/extensions" },
        "extras": { "$ref": "common.schema.json#/$defs/extras" }
      },
      "required": ["type", "points"],
      "unevaluatedProperties": false
    },
    "cubicEdge": {
      "description": "One cubic Bézier segment from this node to the next (extension VTRY_curves, which a file using it lists in extensionsUsed and extensionsRequired). Its two control points, mm, in the piece frame.",
      "type": "object",
      "properties": {
        "type": { "const": "cubic" },
        "controls": {
          "type": "array",
          "items": { "$ref": "common.schema.json#/$defs/vec2" },
          "minItems": 2,
          "maxItems": 2
        },
        "extensions": { "$ref": "common.schema.json#/$defs/extensions" },
        "extras": { "$ref": "common.schema.json#/$defs/extras" }
      },
      "required": ["type", "controls"],
      "unevaluatedProperties": false
    },
    "line": {
      "description": "An open path: nodes in order, each with the edge to the next one, except the last, which has none.",
      "type": "object",
      "properties": {
        "id": { "$ref": "common.schema.json#/$defs/id" },
        "name": { "$ref": "common.schema.json#/$defs/name" },
        "nodes": {
          "type": "array",
          "items": { "$ref": "#/$defs/node", "unevaluatedProperties": false },
          "minItems": 2
        },
        "extensions": { "$ref": "common.schema.json#/$defs/extensions" },
        "extras": { "$ref": "common.schema.json#/$defs/extras" }
      },
      "required": ["id", "nodes"],
      "unevaluatedProperties": false
    },
    "fold": {
      "type": "object",
      "properties": {
        "id": { "$ref": "common.schema.json#/$defs/id" },
        "from": { "description": "Outline node id.", "$ref": "common.schema.json#/$defs/id" },
        "to": { "description": "Outline node id.", "$ref": "common.schema.json#/$defs/id" },
        "extensions": { "$ref": "common.schema.json#/$defs/extensions" },
        "extras": { "$ref": "common.schema.json#/$defs/extras" }
      },
      "required": ["id", "from", "to"],
      "unevaluatedProperties": false
    },
    "cut": {
      "description": "One copy of the piece in the garment. mirrored: the mirror image (x -> -x in the piece frame), the other one of a left/right pair; references into it still use the piece's node ids and the piece frame's directions.",
      "type": "object",
      "properties": {
        "id": { "$ref": "common.schema.json#/$defs/id" },
        "name": { "$ref": "common.schema.json#/$defs/name" },
        "mirrored": { "type": "boolean", "default": false },
        "fabric": {
          "description": "Overrides the garment's fabric for this cut.",
          "$ref": "common.schema.json#/$defs/id"
        },
        "appearance": {
          "description": "Overrides the garment's appearance for this cut.",
          "$ref": "common.schema.json#/$defs/id"
        },
        "placement": { "$ref": "#/$defs/placement" },
        "layout": {
          "description": "Where the cut sits in the 2D pattern view (mm, radians). Display only.",
          "type": "object",
          "properties": {
            "position": { "$ref": "common.schema.json#/$defs/vec2" },
            "rotation": { "type": "number" }
          },
          "unevaluatedProperties": false
        },
        "extensions": { "$ref": "common.schema.json#/$defs/extensions" },
        "extras": { "$ref": "common.schema.json#/$defs/extras" }
      },
      "required": ["id", "placement"],
      "unevaluatedProperties": false
    },
    "placement": {
      "description": "Where the cut starts before sewing. wrap: rolled onto a cylinder around an avatar region. follow: on top of another cut (a pocket on a front), lifted off it.",
      "type": "object",
      "properties": {
        "type": { "enum": ["wrap", "follow"] },
        "region": { "description": "wrap: a region name from the avatar's regions.", "type": "string" },
        "angle": { "description": "Where the piece's centre goes around the axis, radians from the region's zero direction (follow: overrides the followed cut's).", "type": "number" },
        "radius": { "description": "wrap: cylinder radius, mm.", "type": "number", "exclusiveMinimum": 0 },
        "top": { "description": "wrap: position of the piece's top edge along the region's axis, mm from its origin (negative = down a limb).", "type": "number" },
        "rotation": { "description": "In-plane rotation of the piece before wrapping, radians counter-clockwise (after mirroring).", "type": "number" },
        "tube": { "description": "wrap: long sleeves. Below the piece's widest row the radius follows the pattern, tube x width / 2 pi (> 1 leaves a gap so the open edges meet under the arm); above it, it rises linearly to radius at the top edge.", "type": "number", "exclusiveMinimum": 0 },
        "offset": { "description": "wrap: further out than the stack puts it, mm. Never negative; absent is 0.", "type": "number", "minimum": 0 },
        "cut": { "description": "follow: the cut to follow (it must not itself follow this one, directly or not).", "$ref": "common.schema.json#/$defs/id" },
        "lift": { "description": "follow: distance off the followed cut, mm.", "type": "number" },
        "extensions": { "$ref": "common.schema.json#/$defs/extensions" },
        "extras": { "$ref": "common.schema.json#/$defs/extras" }
      },
      "required": ["type"],
      "allOf": [
        { "if": { "properties": { "type": { "const": "wrap" } } }, "then": { "required": ["region", "radius", "top"], "properties": { "cut": false, "lift": false } } },
        { "if": { "properties": { "type": { "const": "follow" } } }, "then": { "required": ["cut"], "properties": { "region": false, "radius": false, "top": false, "tube": false, "rotation": false, "offset": false } } }
      ],
      "unevaluatedProperties": false
    },
    "run": {
      "description": "A stretch of one cut's outline or internal line, between two of its nodes. On the outline, direction says which way round: ccw (the outline's order) or cw, in the piece frame (also for a mirrored cut). On an internal line, the run goes from 'from' to 'to' along the line.",
      "type": "object",
      "properties": {
        "cut": { "$ref": "common.schema.json#/$defs/id" },
        "line": { "description": "Internal line id; absent = the outline.", "$ref": "common.schema.json#/$defs/id" },
        "from": { "$ref": "common.schema.json#/$defs/id" },
        "to": { "$ref": "common.schema.json#/$defs/id" },
        "direction": { "enum": ["ccw", "cw"] },
        "extensions": { "$ref": "common.schema.json#/$defs/extensions" },
        "extras": { "$ref": "common.schema.json#/$defs/extras" }
      },
      "required": ["cut", "from", "to"],
      "if": { "required": ["line"] },
      "then": { "properties": { "direction": false } },
      "else": { "required": ["direction"] },
      "unevaluatedProperties": false
    },
    "seam": {
      "description": "Two sides sewn together, each a chain of runs (a chain may span cuts). The start of a meets the start of b, the end of a the end of b.",
      "type": "object",
      "properties": {
        "id": { "$ref": "common.schema.json#/$defs/id" },
        "name": { "$ref": "common.schema.json#/$defs/name" },
        "a": { "type": "array", "items": { "$ref": "#/$defs/run" }, "minItems": 1 },
        "b": { "type": "array", "items": { "$ref": "#/$defs/run" }, "minItems": 1 },
        "pairing": {
          "description": "nodes: if both sides pass through the same number of nodes, the nodes meet (notches line up) and each stretch in between is matched by length; otherwise as length. length: matched by length along the whole chain.",
          "enum": ["nodes", "length"],
          "default": "nodes"
        },
        "extensions": { "$ref": "common.schema.json#/$defs/extensions" },
        "extras": { "$ref": "common.schema.json#/$defs/extras" }
      },
      "required": ["id", "a", "b"],
      "unevaluatedProperties": false
    },
    "source": {
      "type": "object",
      "properties": {
        "id": { "$ref": "common.schema.json#/$defs/id" },
        "type": { "description": "dxf-aama, valentina, ...", "type": "string" },
        "part": { "description": "Path of the original file in the container, if kept.", "type": "string" },
        "fileName": { "type": "string" },
        "extensions": { "$ref": "common.schema.json#/$defs/extensions" },
        "extras": { "$ref": "common.schema.json#/$defs/extras" }
      },
      "required": ["id", "type"],
      "unevaluatedProperties": false
    }
  }
}
